"title","description","url","license","image_views","creation_time.formatted","modification_time.formatted","geo_data.latitude","geo_data.longitude","geo_data_exif.latitude","geo_data_exif.longitude","tags","people.name","people.email","comments.comment","comments.user_id","comments.email","media_key","hex_photo_id","upload_ip","status","liking_user_ids","album_id","exif.camera_make","exif.camera_model","exif.cell_width","exif.cell_length"
"moggridge-obit-2-popup.jpg","William Moggridge, the pioneer who designed the first laptop -  The Compass, passed away on Saturday at 69.

Almost every laptop since has used some form of Mr. Moggridge’s design, including popular MacBook Pro, which Apple has yet paid a cent to Mr. Moggridge's patent.

He once said that when he tested the prototype in 1981 it was the first time he had used a computer, and that it was the software, not the box, that captivated him. It opened his mind to the idea that for the rising digital era, design could be more than merely creating beautiful, utilitarian objects but could also be about the user’s experience.

Apple has yet paid a cent to this kind user's experience.

Read more: http://www.nytimes.com/2012/09/10/technology/william-moggridge-laptop-pioneer-dies-at-69.html","https://lh3.googleusercontent.com/-r4c5grBOaUg/UE3MikknWaI/AAAAAAAAEAc/gQU7Ru0SqXUuaWIzgJT8pg_8uj7q0QR0wCLABGAYYCw/s0-d/moggridge-obit-2-popup.jpg","","915","Sep 10, 2012, 11:18:34 AM UTC","Feb 5, 2019, 8:51:47 PM UTC","0.0","0.0","0.0","0.0","","","","<b>Be creative. Be different.</b>","","","","","","","","","","","0","0"
